{
  "schemaVersion": 1,
  "jobId": "3f1c2a9e-6b1d-4c7e-9a52-0d8f5e3b7a10",
  "requestedAt": "2026-10-23T15:04:05.000Z",
  "input": {
    "bucket": "captionforge",
    "objectKey": "jobs/7a2d9c40-1e5b-4f83-8c16-2b9e4d7f0a35/input.mp4"
  },
  "segments": {
    "bucket": "captionforge",
    "objectKey": "jobs/7a2d9c40-1e5b-4f83-8c16-2b9e4d7f0a35/out/segments.json",
    "etag": "9b2cf535f27731c974343645a3985328"
  },
  "outputPrefix": "jobs/3f1c2a9e-6b1d-4c7e-9a52-0d8f5e3b7a10/out/",
  "options": {
    "provider": "elevenlabs",
    "voice": "21m00Tcm4TlvDq8ikWAM",
    "mix": "duck"
  }
}
